id,text,Anger,Fear,Joy,Sadness,Surprise
eng_train_track_a_05106,Just my opinion friend. I don't know why it offends you so much.,1,0,0,1,0
eng_train_track_a_05107,I'm sorry friend. I actually used to be pretty good with this but I'm constantly getting worse.,0,0,0,1,1
eng_train_track_a_05108,"""one of us will be right!"" Or...ya both wrong and wasted your energy being dumb asses instead of enjoying it.",1,0,0,0,0
eng_train_track_a_05109,"It's way too broken, anyone and their dog can use it.",1,0,0,0,0
eng_train_track_a_05110,Honestly im a pretty clumsy belligerent and i lasted 9 months and no case is great life i regret nothing,0,0,0,1,0
eng_train_track_a_05111,"indeed, but im worried that this matchup will end up as the biggest bait since years and rookie will crush him badly",0,1,0,0,0
eng_train_track_a_05112,The saddest part is that just this morning when we were laying in bed I was thinking about how much I love him.,0,0,1,1,0
eng_train_track_a_05113,"It just so happened that PD, sick kids , and family emergencies all happened to overlap between all my coworkers leaving me all alone. ",0,0,1,1,0
eng_train_track_a_05114,Worried about it escaping....now that's fresh food.,0,1,1,0,0
eng_train_track_a_05115,"That's fair, I disagree with you, but I'm not here to change your mind. Was just curious. ",1,0,0,0,1
eng_train_track_a_05116,It's so crazy how [NAME] went from being an elite goaltender to barely an ahl bum in a matter of 2-3 years. I cri,1,0,0,1,1
eng_train_track_a_05117,Starting?? BF4 is a lot of fun when you havent played in a while. Just faster and more immersive.,0,0,1,0,1
eng_train_track_a_05118,All burps must be rated out of 10. Neither of us have achieved a 10 so far but I got a 9.5 last week ,0,0,1,1,0
eng_train_track_a_05119,"Wow, that's crazy. Ever tried DMT? ",0,0,1,0,1
eng_train_track_a_05120,"I feel awful posting it, but I couldn't not share :|",0,1,0,0,0
eng_train_track_a_05121,"I don't drink I don't smoke I don't do drugs and yet still am not ""happy rich and all that people say this brings""",0,0,0,1,0
eng_train_track_a_05122,Shrug. Cant blame anyone other than your parents.,1,0,0,0,0
eng_train_track_a_05123,"Happened right in front of our condo. Saw them cover the body after trying to revive him. It's been 6 months, not a year.",0,0,1,0,1
eng_train_track_a_05124,Start caring about Reddit downvotes has to be the weirdest life advice I've received in years.,1,0,0,0,0
eng_train_track_a_05125,"The attraction and the action are two separate things, and you know that. No one chooses who they are attracted to. Stop it. ",1,0,0,0,0
eng_train_track_a_05126,"The last time Russian military contractors met US forces, they lost 200 men and dozens of armored vehicles. Lmao.",0,0,1,1,0
eng_train_track_a_05127,"What? No deal, abort, abort!",1,0,0,0,0
eng_train_track_a_05128,I love him even though the newest season of t@gged kinda sucked.,0,0,1,1,0
eng_train_track_a_05129,Didn't really help who the Master is but [NAME] will lose his damn mind. We video game worlds now.,0,0,1,1,0
eng_train_track_a_05130,Really? I only remember the one in the movie (which did kinda weird me out),1,0,0,0,1
eng_train_track_a_05131,Even weirder way to spell [NAME].,1,0,0,0,0
eng_train_track_a_05132,"Yes that's correct, without TWDG no story based game would exist , but i still like LiS",0,0,1,0,1
eng_train_track_a_05133,"I have, Just i cant talk with them now, ill try to as fast as possible, thank you for your advice! ",1,0,1,0,0
eng_train_track_a_05134,"I still have no idea what ""died three times"" means...",0,0,0,1,1
eng_train_track_a_05135,"holy shit that person is a fucking asshole, talk about a huge red flag for your stepbrother.",1,0,0,0,0
eng_train_track_a_05136,Theyve been around since World Pride. I love this city :D,0,0,1,0,1
eng_train_track_a_05137,"If you've never been to DSA you'd be surprised by how many amazing, smart people you'll meet. ",0,0,1,0,1
eng_train_track_a_05138,Where did you get those tunnels? I love them and would like some myself!,0,0,1,0,1
eng_train_track_a_05139,"i don't usually 'wall of text' posts but i'm glad i made your post an exception. thank you, it brought tears to my eyes.",0,0,1,1,0
eng_train_track_a_05140,Mine starts sweating and wondering why it's so hot if the ac is on! ,0,0,0,0,1
eng_train_track_a_05141,Do you not commute to work? It's still like that during rush hour traffic.,0,0,1,0,1
eng_train_track_a_05142,Lucky you got a sane dad. Get ready for a world of crazy... just don't get sucked into her toxic world. Good luck.,1,0,1,0,0
eng_train_track_a_05143,I think thats dumb and simplistic. You really can't boil down the sociology of race by comparing it to 2+2=4.,1,0,0,0,0
eng_train_track_a_05144,I just worked 6 hrs today and already hate it lol work just sucks. I'm not sure how other people do it.,1,0,0,0,1
eng_train_track_a_05145,While living in Japan? Never say never... but it is very hard to imagine.,0,0,1,0,1
eng_train_track_a_05146,Don't forget the part where [NAME] doubts himself or goes off on his own and fails. Then [NAME] tells him how much she loves him and to run,0,0,1,0,1
eng_train_track_a_05147,Thank you! I'll look for his art. Btw I have no idea what Faces of Death or Traces of Death is,0,0,1,0,1
eng_train_track_a_05148,"BDS is a discriminatory bigoted hateful movement. It's not just ""Oh, I disagree with some things that Israel has done.""",1,0,0,0,0
eng_train_track_a_05149,Im very interested. Contact me if you are going to set one up and want/need help.,0,0,1,0,1
eng_train_track_a_05150,You know they just blamed the neighbor who defended themself.,1,1,0,0,0
eng_train_track_a_05151,[NAME] always looks like he just got handed a test and he realized he studied all the wrong material.,0,0,0,1,0
eng_train_track_a_05152,Great site. Never heard of it. Thank you for passing along!,0,0,1,0,1
eng_train_track_a_05153,"I feel sorry for people that think Reddit (or even some random sub-reddit) is ""an international stage"".",0,0,0,1,0
eng_train_track_a_05154,"There is a revenge story in JNMIL about DIL getting back at MIL involving ground meat. Yes, that MIL sabotage her BC too",0,1,0,0,0
eng_train_track_a_05155,"What a vile, vile country we live in.",0,0,1,0,1
eng_train_track_a_05156,I've never heard of this place. I know what we are doing next time we're up there!,0,0,1,0,1
eng_train_track_a_05157,"There where over 40000 stabbings in the UK last year, and this guy reckons these kids are just acting tough ",1,0,0,0,0
eng_train_track_a_05158,IMO the only place worse to gain than ya stomach is your face ,1,0,0,1,0
eng_train_track_a_05159,I am so sorry for your loss. I lost my Brother a few years back. My thoughts and heart is with you.,0,0,1,1,0
eng_train_track_a_05160,It was salt. This is the laziest dish' I have ever ordered in my life.,1,0,0,0,0
eng_train_track_a_05161,"Great, so we know the spanish pronounciation is therefore racist and now I'm offended by it.",0,0,0,1,1
eng_train_track_a_05162,"Sitting here, waiting for the price to drop so i can buy more. I guess it's not gonna happen.",1,0,0,1,0
eng_train_track_a_05163,Wrong. And UBI sucks unless you include an expansive social safety net too,1,0,0,1,0
eng_train_track_a_05164,Just horrible. Doesnt solve any of his problem and removes his strongest tool.,0,0,0,0,1
eng_train_track_a_05165,Bingo! I would not/could not be in a relationship with someone who denies their child a parent by choice.,1,0,1,0,0
eng_train_track_a_05166,I'm 34 and disappointing my mother is still my greatest fear.,0,1,0,0,0
eng_train_track_a_05167,I'm surprised that any of this is considered that big of a deal. At least he wasn't molesting little kids.,0,0,1,0,1
eng_train_track_a_05168,And get off the phone! Why are you browsing Reddit on a date!?!?!,1,0,0,0,1
eng_train_track_a_05169,Oh shit. You're that bet welcher aren't you?,0,0,0,0,1
eng_train_track_a_05170,"Good point, it's nice and frustrating for both sides I see. Definitely worse for the lower levels. That's too bad",1,0,0,0,0
eng_train_track_a_05171,"He's not THAT bad on YouTube, but on Twitter... Let's just say that he's problematic",1,0,0,0,0
eng_train_track_a_05172,Damn I WANT to hear this!!!,1,0,0,0,0
eng_train_track_a_05173,You're a bit of a wet wipe aren't you?,1,0,0,0,0
eng_train_track_a_05174,"Well Happy Birthday from another random stranger on the internet. I spent my birthday mostly alone too, hope your day wasn't too bad. ",0,0,1,1,0
eng_train_track_a_05175,He can't rescind. What a dumbass,1,0,0,0,0
eng_train_track_a_05176,Don't worry about it I meant what I said thank you really,0,1,1,0,0
eng_train_track_a_05177,That guy who melodramatically dances around playing horribly soppy poppy chord progressions over and over and does a cringy dance that makes me want to kill things?,1,0,0,0,1
eng_train_track_a_05178,I like you. No promo,1,0,1,0,0
eng_train_track_a_05179,I am clueless lately. None of my students parents speak English. It breaks my heart because I want to have more open communication.,0,0,0,1,1
eng_train_track_a_05180,"Oh man, dream date right there. Zoo then sushi?? Yes please. ",0,0,0,0,1
eng_train_track_a_05181,Whatever mental condition he has is far worse than autism.,0,0,0,1,0
eng_train_track_a_05182,Wow random irrelevant internet person has the secret goods on [NAME]. Maybe we'll finally get to the bottom of this birth certificate thing...,0,0,1,0,1
eng_train_track_a_05183,"How is that relevant? The rules are simple, do not attack character.",0,0,1,0,1
eng_train_track_a_05184,I'm not the disgusting. I take good care of her. I just have barriers. What is wrong with that?,1,0,1,0,1
eng_train_track_a_05185,"So America and the USSR are the exact same thing to you? Sorry you're so small minded, hope you learn to grow in the future.",0,0,1,1,0
eng_train_track_a_05186,Yeah until the last one has creepily wed and reproduced.,0,1,0,0,0
eng_train_track_a_05187,"I love and stan Manila , I always will. BUT the fan base worshipping the ground she walks on is getting so irritating ngl",1,0,1,0,0
eng_train_track_a_05188,"Damn, I was really hoping for some comeuppance at the end, but at least you no longer have her for a boss, so silver lining.",1,0,1,0,1
eng_train_track_a_05189,What type of migraine do you think it is? Hope you get better soon,0,0,1,0,1
eng_train_track_a_05190,Is that how you deal with people you disagree with? Nice personal fantasy you have there.,0,0,1,0,1
eng_train_track_a_05191,This game is a pain in the ass. There are few things as infuriating as getting dicked by 3s all game. Flashbacks to the 2nd Orlando game.,1,0,0,0,0
eng_train_track_a_05192,Damn man that's a lot of progress. You willing to put forth another 2 and a half months getting your new character back up there?,0,0,1,0,1
eng_train_track_a_05193,Honestly right now I just need to know why our usernames are so similar. Haha...,0,0,1,0,1
eng_train_track_a_05194,"You too! (FYI I accidentally initially replied in a new comment, in case you didn't see my other reply)",0,0,1,0,1
eng_train_track_a_05195,It bothers me that certain people praise him as an entertainer and could care unless about what he did. Look at [NAME]... Makes me question humanity,0,1,0,0,0
eng_train_track_a_05196,"It's awesome. Sorry, I am a red-blooded male. I see a beautiful woman with a thick 10/10 body and I like it. ",0,0,1,1,0
eng_train_track_a_05197,[NAME] I hate that I had to upvote this dude to the sub it is in. Every fibre of my being wants to downvote this atrocity,1,0,0,0,0
eng_train_track_a_05198,They're my favorite couple that's ever been on this show,0,0,1,0,1
eng_train_track_a_05199,I'm sorry for your loss bro ,0,0,0,1,0
eng_train_track_a_05200,"Sorry, your diverse, inclusive baby was aborted.",0,0,0,1,0
eng_train_track_a_05201,Woops. I'll keep it that way. Never be tired AF and post on reddit y'all.,0,0,0,1,0
eng_train_track_a_05202,"It sucks being unattractive. It pisses me off that there are so many beautiful people in the world, and I ain't one of them.",0,0,0,1,0
eng_train_track_a_05203,oh thank you! im relatively new-ish and did not know that,1,0,1,0,0
eng_train_track_a_05204,"I didn't think it was possible for one Twitter account to be so obnoxious, but here it is.",0,0,0,1,0
eng_train_track_a_05205,"Huge loss. Good job boys! Now go out there, give your best and prove that [NAME] didn't die for nothing!",0,0,1,1,0
eng_train_track_a_05206,">Being sexually desired False, since there are a lot of things you can change on yourself to be more desirable. Also you act out of experience.",1,0,0,0,1
eng_train_track_a_05207,"I hope your brother is okay. Don't listen to this guy, he's a cunt.",1,0,1,0,0
eng_train_track_a_05208,Yep...this sub blasted me for hating the casey hire and still refuses to admit his big faults,1,0,0,0,0
eng_train_track_a_05209,"Yea, husband learned his lesson quite quick. Thank you! :)",0,0,1,0,1
eng_train_track_a_05210,They are the best but my office is so far away ,0,0,1,1,0
eng_train_track_a_05211,I'm surprised who posted this bc she's normally a sweet women but then there was this,0,0,1,0,1
eng_train_track_a_05212,[NAME] is going to be jealous of this photo,1,0,0,1,0
eng_train_track_a_05213,"Nah she's just a dull asari doctor, with a pleasing voice.",1,0,1,1,0
eng_train_track_a_05214,"I still think [NAME] is better, [NAME] normal are really bad... ",0,0,1,1,0
eng_train_track_a_05215,"Interesting article, terrible author. Plagued with grammatical errors.",0,0,1,1,0
eng_train_track_a_05216,"Welcome to CTH where everyone pretends that socialism will work, next time.",1,0,1,0,0
eng_train_track_a_05217,"I mean, a lot of animals I've seen get terrified of regular stuffed animals, imagine having your fears super sized like that",0,1,0,0,0
eng_train_track_a_05218,"It has no value, it's just a representative of it like all other money.",0,0,1,0,1
eng_train_track_a_05219,I believe you copied and paste from somewhere or previous answer. We are definitely not talking about the same thing. Hope you get better man. Cheers.,0,0,1,0,1
eng_train_track_a_05220,*oh god oh fuck*,1,0,0,0,0
eng_train_track_a_05221,Who the hell has all these power tools but no hammer,1,0,0,1,0
eng_train_track_a_05222,Damn you really love using name calling as a crutch don't you?,1,0,1,0,1
eng_train_track_a_05223,How can he be cool? Pretty sure he has sexually harassed women.,1,0,0,0,1
eng_train_track_a_05224,I didnt really think about having a wife as an object until recently in a bout of frustration induced fantasy.,1,0,1,0,1
eng_train_track_a_05225,"Thanks, I'd never heard this information. Only ""humans have the best endurance""",0,0,1,0,1
eng_train_track_a_05226,Oh sorry if I seemed dishonest. I hope you can make it through your mourning.,0,0,1,1,0
eng_train_track_a_05227,"Here did you know that [NAME] slept with 35,000 women. Outrageous.",0,0,0,0,1
eng_train_track_a_05228,"Lore wise, this makes sense and I hate/love it with the same energy ",0,0,1,0,1
eng_train_track_a_05229,"[NAME] won it last year, even with all our goal kickers. Didn't think it would happen again with our set up.",0,0,1,0,1
eng_train_track_a_05230,Lol always a creepy mike,0,1,1,0,0
eng_train_track_a_05231,"Wow. I just read the synopsis, and that's really what happens. ",0,0,1,0,1
eng_train_track_a_05232,He probably got hurt making the video,0,0,0,1,0
eng_train_track_a_05233,I haven't been much on this sub recently. Is this a common theme?? If so that's just freaky.,0,0,1,0,1
eng_train_track_a_05234,My condolences. Lost my cat Zoey over a year ago. I still miss her like crazy. she was only 3 years old too.,0,0,0,1,1
eng_train_track_a_05235,Biting the hand that feeds them,1,0,0,0,0
eng_train_track_a_05236,">Missing skillset >Guy I mean, I don't want to say it's *free*, but it's pretty damn likely.",0,0,1,0,1
eng_train_track_a_05237,"Except they fucking awarded it a prize first. It went through vetting, beat the other applicants, won, then was removed as not being correct?",1,0,0,0,1
eng_train_track_a_05238,Wait for real? That's how they met? lol that's both terrifying and completely fitting considering how nuts they both are,0,1,1,0,1
eng_train_track_a_05239,"No, he wasn't the entire problem, but his performance can't be excused by coaching alone. He's just not very good.",1,0,0,1,0
eng_train_track_a_05240,"Oh, the horror! We must defend the honor of Lord [NAME] against the scum of r/NFL!!",1,1,0,0,0
eng_train_track_a_05241,"I didn't know that having the occupation of a journalist and the method of ones murder being beheading, gives ones death a special status. ",0,0,0,0,1
eng_train_track_a_05242,Is that Arcade club i spy? I love it there!,0,0,1,0,1
eng_train_track_a_05243,That live snail got me freaked,1,0,0,0,0
eng_train_track_a_05244,"Except for that ridiculous tongue action, she has quite a pretty face.",1,0,1,0,0
eng_train_track_a_05245,I try my damndest. Hard to be sad these days when I got this guy with me,0,0,0,1,1
eng_train_track_a_05246,Why else? Seems that it is just lack of imagination on your part.,0,0,0,0,1
eng_train_track_a_05247,"Really? wow. I just reinstalled chrome from scratch, again. So it was Ghostery that caused the full screen issues?",0,0,0,0,1
eng_train_track_a_05248,"True, we take pink and black pills daily, even some stacies are conscious of world around them being a grim place.",0,0,1,0,1
eng_train_track_a_05249,"""Oh, when you were an infant you wanted to be around me ALL THE TIME! Your evil wife must be why you changed!"" ",1,0,0,0,1
eng_train_track_a_05250,"""Do we need a GoFundMe for automated doors"" hahahah!",0,0,1,0,1
eng_train_track_a_05251,"Lived this, it didn't workout for me. Good luck on that one, I'd never do it again.",0,0,1,0,1
eng_train_track_a_05252,"Eh, not sure we shoulda fired [NAME]. [NAME] was regarded as one of the best for quite a long time. ",0,0,1,0,1
eng_train_track_a_05253,"Well I like [NAME] but other than her, I don't know any interesting asian youtubers. so help me out",0,0,1,0,1
eng_train_track_a_05254,I spent the entire time trying not to yell at the TV. [NAME] and [NAME] can fuck right off.,1,0,0,0,0
eng_train_track_a_05255,That's a lot of calories!,0,0,1,0,1
eng_train_track_a_05256,"I love learning, but I can't be asked.. ",1,0,1,0,0
eng_train_track_a_05257,An entire family gone within minutes... how absolutely heartbreaking.,0,0,0,1,0
eng_train_track_a_05258,Has Medicaid stopped? Most people I know who support this want Medicare or Medicaid for all.,0,0,1,0,1
eng_train_track_a_05259,SEVEN parrots? Wow. Bit of a hoarder there.,0,0,1,0,1
eng_train_track_a_05260,Growing up there were people in our church who hated the Smurfs because they were magic using communists.,1,0,0,1,0
eng_train_track_a_05261,That's just reckless. He's lucky he didn't get permanently disfigured or killed.,1,0,1,0,0
eng_train_track_a_05262,"Thats awful, I'm so sorry for your loss",0,0,0,1,0
eng_train_track_a_05263,"Have you visited any of the car subs? They may be able to help you diagnose the issue. Good luck though, I hope ya pull through. ",0,0,1,0,1
eng_train_track_a_05264,Hilariously wrong and uncontroversial.,1,0,0,0,0
eng_train_track_a_05265,Ah!! Was not expecting to read that this morning on my commute  lol Just so beautiful! ,0,0,1,0,1
eng_train_track_a_05266,The only time petty revenge backfired lol at least from what I understood unless I missed something,0,0,1,0,1
eng_train_track_a_05267,This comparison pic kills me! Stassi looks like a California Raisin!!,1,0,0,0,0
eng_train_track_a_05268,"That one is my favorite btw, its delicious. sorry you couldn't have it :(",1,0,1,0,0
eng_train_track_a_05269,"Ah, didn't know that but can't blame him. Thanks!",1,0,1,0,0
eng_train_track_a_05270,Cause this isn't a woman its a dude :D,0,0,1,0,1
eng_train_track_a_05271,Sorry but I don't keep up with YT celebs or drama What happened to [NAME] ?,0,0,0,1,1
eng_train_track_a_05272,Dude your source on the school says they would investigate. Not a condemnation. Not in any stretch.,1,0,1,0,0
eng_train_track_a_05273,> A good jab to the sternum is what I was taught. maybe a sharpened bat would work better?,0,0,1,0,1
eng_train_track_a_05274,that made me cry tears of sadness and joy at the same time.,0,0,1,1,0
eng_train_track_a_05275,Wait... I have been in two movies and I have played [NAME] in both.,0,0,1,0,1
eng_train_track_a_05276,I shed a tear at how beautifully well said this comment was.,0,0,1,1,0
eng_train_track_a_05277,Have fun insulting me then. I have fun building and using BSV Insults are too low for me to participate. Sorry,0,0,1,1,0
eng_train_track_a_05278,"I was impressed by your company in the initial post, but now I see they tried to fire you for their mistake. Glad you had some backing!",0,0,1,0,1
eng_train_track_a_05279,I've only been there once but really enjoyed it!! But I think it's missing a pool table ;),0,0,1,1,0
eng_train_track_a_05280,I know I haven't been myself lately but listen! I can do better and I can change!,0,0,1,0,1
eng_train_track_a_05281,Just save and reload. I doubt that when you reload you gonna stuck again.,0,0,1,0,1
eng_train_track_a_05282,Yikes on the sauce!!,0,0,0,0,1
eng_train_track_a_05283,What's all this [NAME] business? Edit: Thanks for the info below everyone ,0,0,1,0,1
eng_train_track_a_05284,"Just scrolling through their sub, they seem to be upset they lost [NAME]. Hope he's the right guy for the job",0,0,1,1,0
eng_train_track_a_05285,I can't believe that we've seen this ep before and missed the poster. Wish I could upvote y more than once.,0,0,1,0,1
eng_train_track_a_05286,"Um, I was agreeing the context was indeed *very* different. Not sure what you're getting at. ",0,0,1,0,1
eng_train_track_a_05287,"I didn't say [NAME] was on the left. I asked how he isnt on the left, because I dont know. Thanks for your help.",0,0,1,0,1
eng_train_track_a_05288,I really love the sorta sharp angles you used !,0,0,1,0,1
eng_train_track_a_05289,"Also, if for some stupid reason you want to pull a move like this, you better shoulder check ",1,0,1,0,0
eng_train_track_a_05290,He has a humiliation kink. He's clearly not expressing it in a healthy way and should probably see a therapist and/or a professional [NAME].,0,0,1,0,1
eng_train_track_a_05291,I'm crying. Their faces ,0,0,1,1,0
eng_train_track_a_05292,"I really enjoyed Fractured But Whole, but I don't remember the meals being significant (it's been like a year). Can you explain?",0,0,1,0,1
eng_train_track_a_05293,"Look at their post history, they're just spouting nonsense to get a rise out of people. Dont be the guy that falls for it, its embarassing",0,0,0,1,1
eng_train_track_a_05294,No! They're still on the sidewalk right there! With literally absolutely no way around them!,1,1,0,0,0
eng_train_track_a_05295,"Haha, just like teaching.",0,0,1,0,1
eng_train_track_a_05296,Going through the same thing and I feel the same way. Sadness. I hope it'll pass!,0,0,1,1,0
eng_train_track_a_05297,Sort of like a window?,0,0,0,0,1
eng_train_track_a_05298,The fucking worst game in the world.,1,0,0,0,0
eng_train_track_a_05299,Damn don't sell this,1,0,0,0,0
eng_train_track_a_05300,"I'm sorry to inform you, it's worse. ",0,0,0,1,0
eng_train_track_a_05301,"From what I remember, a lot of the leafs fans had [NAME] from 8.5-9.25. I can't recall someone saying 10+",1,0,1,0,0
eng_train_track_a_05302,"Attention, [NAME]! The Empire is attacking the city! I've got a score to settle...",0,1,0,1,0
eng_train_track_a_05303,"Good meme, nice meme",0,0,1,1,0
eng_train_track_a_05304,I honestly miss [NAME],0,0,0,1,1
eng_train_track_a_05305,"I'll admit. I wanted to be upset because I don't identify as a feminist, but also that dress is super cute omg you are very talented",0,0,1,1,0
eng_train_track_a_05306,"Please, you deserve life, you know it deep down inside ",0,0,1,1,0
eng_train_track_a_05307,"No, no. I love the ones where patients succeed. It's not that. It just seemed like everyone phoned it in this time. ",0,0,1,0,1
eng_train_track_a_05308,...and life can be very good when you free yourself from that fear!,0,1,1,0,0
eng_train_track_a_05309,"How did [NAME] just give that beatdown to Attach, the other player was so far away.",0,0,0,0,1
eng_train_track_a_05310,You called yourself a Met fan. THAT is embarrassing. Edit: called themselves a Met fan and didn't know who [NAME] was AMD disrespected him.,1,0,0,1,0
eng_train_track_a_05311,You guys really took this loss well. I'm stunned at how not-salty you minor leaguers are taking it. Totally not full of excuses and what-ifs.,0,0,1,0,1
eng_train_track_a_05312,"I highly doubt he's still her friend, and i would be surprised if she remained friends with [NAME] if [NAME] chooses to stay with him. ",0,0,0,0,1
eng_train_track_a_05313,Human life has value. Veganism and pro-life are 2 completely different ballparks morally. Terrible argument 1/10,1,0,1,0,0
eng_train_track_a_05314,The comment thread is a hot mess and wouldnt be out of place in 2016. How do things not change....,0,0,0,1,1
eng_train_track_a_05315,Now I hate the giants as much as the next but they're 4th in average attendance and percentage.,1,0,0,0,0
eng_train_track_a_05316,they're shite - disgruntled OCSC fan,1,0,0,0,0
eng_train_track_a_05317,"Omg. I just noticed that! Holy fuck, how does she smell?",0,0,0,0,1
eng_train_track_a_05318,This team doesn't deserve to go the playoffs. Only [NAME] deserves to go. Is that possible?,1,0,1,0,1
eng_train_track_a_05319,No surprise there. It was always his policy to table it upon the deal's failure in Parliament as was set out at the Labour conference.,1,0,0,0,0
eng_train_track_a_05320,"[NAME] help us, if that's what she's saying about Catholicism 101 stuff, I shudder to think what other terrible information she's putting out",1,0,0,0,1
eng_train_track_a_05321,This is so scary but true,0,1,1,0,0
