id,text,Anger,Fear,Joy,Sadness,Surprise
eng_train_track_a_03576,are you dumb bro? please watch again and don't downvote me for stating facts. holy shit you're inept.,1,0,0,0,0
eng_train_track_a_03577,"Racism is as racism does - so yeah, goin' out and willfully doing racist shit is indeed racist. Not too hard to grasp.",1,0,0,1,0
eng_train_track_a_03578,Someone off screen threw one back at him I would assume,1,0,1,0,0
eng_train_track_a_03579,Totally disagree. I love this look.,1,0,1,0,0
eng_train_track_a_03580,why did i expect this to be anything other than what it is,0,0,0,0,1
eng_train_track_a_03581,I wish I had your efficiency. I can be at work a full shift and still get almost nothing done.,0,0,1,1,0
eng_train_track_a_03582,"Oh god, never thought of the implications of [NAME] not selling BB-8 as mirroring her parents giving her up. That tugs the heartstrings a little bit.",0,0,0,1,0
eng_train_track_a_03583,Don't worry about stupid people and you do whatever you want. Screw them kind of people.,0,1,0,0,0
eng_train_track_a_03584,Poeling is looking like a fkn stud. Imagine our C depth next season... [NAME]... holy fuck,1,0,0,1,0
eng_train_track_a_03585,dae [NAME] IS MOMMY FUCK MY ASS WITH A BACKHOE MOTHER YES GAWD *tongue pop* WHAT A TALENTED ACTRESS BUT ALSO PARENTAL FIGURE,1,0,0,0,0
eng_train_track_a_03586,"Yeah, It's just difficult to resist the lure of the dark side.",1,0,0,1,0
eng_train_track_a_03587,This person should be outed to the world. What a reckless pos,1,0,0,0,0
eng_train_track_a_03588,"He wants to make excuses for his affair and I doubt you'll feel better after listening to him. In fact, you may actually feel worse. ",1,0,0,0,0
eng_train_track_a_03589,"You can't post a Sons pic and then say ""I got this"", that just hurts.",1,0,0,1,0
eng_train_track_a_03590,I've had all this... except for the last part.,0,0,1,1,0
eng_train_track_a_03591,Why does he take offense to something that you did to YOUR body? It's YOUR body. I think it's blatant disrespect from his part.,1,0,0,0,0
eng_train_track_a_03592,"It depresses me that the Carousel revamp has been a popular answer. Thats not a change, that a sliding scale adjustment.",0,0,0,1,0
eng_train_track_a_03593,if it shatters your little ego i'm fine with this. :),1,0,0,0,0
eng_train_track_a_03594,"So you don't agree with having success, self-worth and self-respect, and a purpose in life?",1,0,0,0,0
eng_train_track_a_03595,"That woman gave me nightmares as a child. Also, you probably know this but she also plays [NAME] aunt in the third movie!",0,1,1,0,0
eng_train_track_a_03596,"Both good and not so good, but mostly good! You should DESTROY HER. NOBODY NEEDS TO TAKE UP THAT MUCH SPACE ON THE CURB. ",1,0,0,0,0
eng_train_track_a_03597,Zero chance. Jeeze.,0,0,0,1,1
eng_train_track_a_03598,Protip- just smell your damn food. Use your senses!,1,0,0,0,0
eng_train_track_a_03599,">Bad request. this is some dank-tier meme that I'm not authorised to see, thanks [NAME]!",1,0,1,0,0
eng_train_track_a_03600,One of my favorite films. I got to see a screening with a live soundtrack conducted by [NAME]. There were tears in my eyes!,0,0,0,1,0
eng_train_track_a_03601,If they want to attack [RELIGION] they should be honest with the website title Imagine a [RELIGION] creating a website and calling it WikiChristianity and constantly attack [RELIGION].,1,0,0,0,0
eng_train_track_a_03602,I could not agree with you more! These selfish women crying abuse to manipulate.,1,0,0,0,0
eng_train_track_a_03603,That's such a lazy way of looking at things.,1,0,0,1,0
eng_train_track_a_03604,"Idk, he could claim the victim jumped in front of his truck. There's no one to deny his side of the story.",0,0,0,0,1
eng_train_track_a_03605,Says nothing about a 2nd interview,1,0,0,1,0
eng_train_track_a_03606,Ugh I'm sorry man! Jerk off until your heart is content and don't apologize for it!,0,0,0,1,0
eng_train_track_a_03607,It's called a fullstop in England. My fucking immersion in this meme is ruined.,1,0,0,0,0
eng_train_track_a_03608,why are other dashers such [NAME] who made y'all so upset,0,0,0,1,1
eng_train_track_a_03609,"I agree with you, but you know, sharia *is* sharia, which I find a tad more frightening ",0,1,1,0,0
eng_train_track_a_03610,It really sucks people are downvoting you just because they were worried about blowing themselves up just like us nova bomb users.,1,1,0,0,0
eng_train_track_a_03611,I want to so bad it hurts. I guess I'm just scared.,0,1,0,1,0
eng_train_track_a_03612,*looks at title* IS THAT A JOJO REFERENCE?!?!?!?!?!?,0,0,0,0,1
eng_train_track_a_03613,"I dont disagree with taking the first steps, I just wish we would be even more ambitious. ",1,0,1,0,0
eng_train_track_a_03614,"Im sorry that I'm only able to give a single upvote for this wonderful, graphic, and accurate visualization.",0,0,1,1,0
eng_train_track_a_03615,You can't say that that's racist!!!!!!,1,0,0,0,0
eng_train_track_a_03616,Seriously?! These [NAME] have no common decency or respect for others suffering!,1,0,0,1,0
eng_train_track_a_03617,Sounds like you work for a terrible company,0,1,0,0,0
eng_train_track_a_03618,I'm sorry but data and facts are more important than the emotional experience of having lived through something.,0,0,0,1,1
eng_train_track_a_03619,"Too bad we couldn't elect a good leader in 2016...instead we got a bum. Oh well, [NAME] is finished. [NAME] 2020 ",0,0,0,1,0
eng_train_track_a_03620,Wasn't there some sort of human Cylon orgy in The Plan or am I misremembering? Because I have bad memories of [NAME] and sexytimes.,0,0,0,1,1
eng_train_track_a_03621,I lost it when all the heroes kept going back and forth into siege range,1,0,0,1,0
eng_train_track_a_03622,"I know to you Professor, break time is nothing. But to me, it's serious.",1,1,0,0,0
eng_train_track_a_03623,WHAT THE HELL?!?!?!?,1,0,0,0,0
eng_train_track_a_03624,WHAT IS HAPPENING,0,0,0,0,1
eng_train_track_a_03625,And it's stopped. Training cancelled :-),0,0,1,1,0
eng_train_track_a_03626,"Yeah, I haven't kept up with that show lol ",1,0,1,0,0
eng_train_track_a_03627,I loved this costume and wasn't even aware of the amount of hate it had until recently,0,0,0,0,1
eng_train_track_a_03628,You shut your mouth,1,0,0,1,0
eng_train_track_a_03629,Mixed drinks are tastier. And I hate raw clear spirits in particular.,1,0,1,0,0
eng_train_track_a_03630,"sadly it would take wayyyyyy more than this to ever change custody agreements. documenting it for her own sanity is a good idea, though.",0,0,1,1,0
eng_train_track_a_03631,I'll put it into context. I love DBZ. I hated Battle of the Gods + Resurrection of Freeza. I *fucking adore* Super Broly.,1,0,1,0,0
eng_train_track_a_03632,Absolutely. I have 3 kids with this woman. My guilt is compounded because I will be tearing their worlds apart too.,0,0,1,1,0
eng_train_track_a_03633,"I think you also underestimate how big Chelsea has become, especially in the States",1,0,0,1,0
eng_train_track_a_03634,Can we put down weed bro? He's faced too much suffering.,0,0,0,1,1
eng_train_track_a_03635,I have a bad feeling I'm gonna regret not tuning into this,1,0,0,1,0
eng_train_track_a_03636,Tbh idgaf anymore too many people correct me and others over it. Who cares. But thanks for the enlightenment.,1,0,1,0,0
eng_train_track_a_03637,"Oh btw this was me yesterday, commenting on that ""ugly"" ban! ",1,0,0,0,1
eng_train_track_a_03638,>[NAME] pulls publicity drama stunt with mild success. FTFY,1,0,0,0,0
eng_train_track_a_03639,uuuuugh what keeps the penis spitting,0,1,0,0,1
eng_train_track_a_03640,"Unfortunately, this sub is slowly being populated by prequel revisionists and the good-ol-day guys. ",1,0,0,1,0
eng_train_track_a_03641,"Oh [NAME], someone did it already, and it was 3 DAYS AGO O.O",0,0,0,0,1
eng_train_track_a_03642,"It's not his fault, it's your wife's. Shes the one you need to be pissed at",1,0,0,0,0
eng_train_track_a_03643,"I love Earth Balance, but does anyone know if the palm fruit is ethically sourced? I've cut out palm products due to deforestation. ",0,0,0,0,1
eng_train_track_a_03644, wow... I read it all in a serious tone until the end! ,0,0,1,1,0
eng_train_track_a_03645,I can't understand why Pepsi and Coke are the two most popular sodas. Or why fans think they're so different.,0,0,0,0,1
eng_train_track_a_03646,"Yea but I hate existing, it's nothing but sadness ",0,0,0,1,0
eng_train_track_a_03647,"They played loud music on a school night', seriously! You're backing the bastards here just to be contrary.",1,0,0,0,1
eng_train_track_a_03648,Her comments are disgusting. Reminds me of my mother. I'm so sorry.,0,0,0,1,1
eng_train_track_a_03649,"And Mac and cheese is shit too. If a grown man has to eat children's food, then STAHMs can get minimum wage jobs",1,0,0,0,0
eng_train_track_a_03650,Oh my bad hahaha,0,0,1,1,0
eng_train_track_a_03651,Waterspouts might be one of nature's most beautiful dangerous things,0,1,0,0,0
eng_train_track_a_03652,"Wow, they are actually struggling against the Hawks for 3 full quarters. ",0,0,0,1,1
eng_train_track_a_03653,"Wait that's a thing? Because that didn't happen when I was young, I don't think",0,0,0,0,1
eng_train_track_a_03654,Wow! What are the odds of that!?,0,0,0,0,1
eng_train_track_a_03655,Yeah that's what I meant but I wrote it stupidly. Did you start with really low weight? Like really low?,1,0,0,0,0
eng_train_track_a_03656,It's one of my worst nightmares to have skin like that...I hope that person gets actual help,0,0,1,1,0
eng_train_track_a_03657,Refs Twitter in shambles,1,0,0,1,0
eng_train_track_a_03658,I don't. I only know about it from the internet. I had no idea.,1,0,0,0,1
eng_train_track_a_03659,"So are we discussing the bill as it is written, or this new imaginary bill you just proposed? ",0,0,0,0,1
eng_train_track_a_03660,Pretty sure they claimed he resisted arrest. If I remember correctly he was just peacefully sitting on the curb when the cops decided he was resisting.,1,0,0,0,1
eng_train_track_a_03661,"Yes, all the time when I can tell somebody is upset with me. Allistic peeps really refuse to communicate clearly it's the worst!",1,0,0,1,0
eng_train_track_a_03662,Looks like a badly designed [NAME] avatar,1,0,0,0,0
eng_train_track_a_03663,> I want to feel peace and not have to wake up everyday anxious for what the day has in store. I can relate to this.,0,1,1,0,0
eng_train_track_a_03664,I hate y'all too,1,0,0,0,0
eng_train_track_a_03665,"Bro, pay attention. I know you guys aren't known for that, but this is not a centrist sub. For [NAME] sake read for one",1,0,1,0,0
eng_train_track_a_03666,I am sad to hear about your cat. Pets become like a family member. I am glad to hear you are doing better.,0,0,1,1,0
eng_train_track_a_03667,"My condolences, cheese is magnificent!",0,0,1,1,0
eng_train_track_a_03668,She's passed away.,0,0,0,1,0
eng_train_track_a_03669,"Life is nothing but a hell filled with torment, misery and loss.",1,0,0,1,0
eng_train_track_a_03670,The only way this is OK is if their kid made it for them. But then you feel bad for the kid. Lose lose..,0,0,1,1,0
eng_train_track_a_03671,So many great shows they killed because they didn't advertise them and put them at terrible air times :(,1,0,0,1,0
eng_train_track_a_03672,I wish I could help you but I'm in the same ditch as you. High school is causing me troubles too,0,0,1,1,0
eng_train_track_a_03673,"If we're bullies, what does that make police who actually arrest people for rape and pedophilia? The final boss?",1,0,0,0,1
eng_train_track_a_03674,what app is this? i see the layout every now and then i'm just curious,0,0,0,0,1
eng_train_track_a_03675,I've never heard of this before. That's awful.,1,0,0,1,0
eng_train_track_a_03676,"""Being able to attract women"" shouldn't be the only way you rate how good a person is. That's ridiculous.",1,0,0,0,0
eng_train_track_a_03677,This is one of the new accounts that tried to call me a cunt!,1,0,0,1,0
eng_train_track_a_03678,"What the hell does metaphysics have to do with this? Also it's a meme, get over yourself. ",1,0,0,0,1
eng_train_track_a_03679,[NAME] i really hate entitled people. Upvote if you think that EPs are worse than Antivaxxers.,1,0,0,0,0
eng_train_track_a_03680,> no one wants to smell like a goat. HA! That's amazing. I love it.,1,0,1,0,0
eng_train_track_a_03681,I'm praying they get a spin-off. Keep this crap off my VPR.,1,0,1,0,0
eng_train_track_a_03682,"1, you,, you,, actually shat on a hamster? 2. Washing your hamster can kill it 3. You fucking shat on your hamster",1,0,1,0,1
eng_train_track_a_03683,Why the fuck are you smiling for? Fuck you.,1,0,0,0,0
eng_train_track_a_03684,Well he gets an A+ for fackin over the people!,1,0,1,0,0
eng_train_track_a_03685,"Sadly, the military is archaic about non-conforming relationships. :/ I wish more of these decals existed. ",0,0,1,1,0
eng_train_track_a_03686,"Sorry, I have plans that day, week, month. Watching TV while you peruse Reddit are plans aren't they???",0,0,0,1,1
eng_train_track_a_03687,You're not a loser. You're a whole and complete person unto yourself.,1,0,1,0,0
eng_train_track_a_03688,When I was maybe 8 I discovered that I liked hot dog buns with just ketchup. I shortly discovered what heartburn was.,0,0,0,1,0
eng_train_track_a_03689,"Bowling makes me feel better, it's hard to be mad when you're bowling with some pals",1,0,0,1,0
eng_train_track_a_03690,"And in some US states, still that range just sets off weird vibes.",0,0,0,1,0
eng_train_track_a_03691,Looks like [NAME] had the last laugh with [NAME]. Everybody was calling them foolish for not choosing Beale St.,1,0,0,1,0
eng_train_track_a_03692,"You have too many knives, I don't trust you. Sociopath.",1,1,0,0,0
eng_train_track_a_03693,"Never made it through, it makes me physically ill just seeing images of that monster combined with him describing his incomprehensible evil.",0,1,0,0,0
eng_train_track_a_03694,"Yeah, well your just jealous that you don't have a cunt like me.",0,0,1,1,0
eng_train_track_a_03695,Fuck if I only could have those a single family home prices back :( maybe I wouldn't be living in my RV,0,0,0,1,0
eng_train_track_a_03696,"Very hot take there, It'd be a shame if somebody... disrupted it. ",0,0,0,1,0
eng_train_track_a_03697,Rightfully so. I had it as a child and it was the worst experience in my life. I'm also vulnerable for shingles now. Yaaay.,1,1,0,0,0
eng_train_track_a_03698,"Simply wearing the MAGA hat is proof he's a racist little shit-lord and ""his side of the story"" was clearly written by a PR firm. ",1,0,0,0,0
eng_train_track_a_03699,But he is. He won't talk to us. [NAME] damnit OP answer us!!,1,0,0,0,0
eng_train_track_a_03700,Would you start by cutting all education or by cutting all healthcare?,0,0,0,0,1
eng_train_track_a_03701,"Man, I assumed it was already out and I'd missed it.",0,0,0,0,1
eng_train_track_a_03702,What a sad post. I cannot believe people actually follow their advice.,1,0,0,1,0
eng_train_track_a_03703,I was entertained into the 4th. My sons played well. We lost. I'll take it.,0,0,1,1,0
eng_train_track_a_03704,"I used to have no problems finding them, but I'm struggling really hard now",0,0,0,1,1
eng_train_track_a_03705,U will hate it shortly,1,0,0,1,0
eng_train_track_a_03706,"Only six colors for this look, sweaty? I could do the same look with sixteen.",0,0,0,1,1
eng_train_track_a_03707,"I appreciate your post, I'm just nervous is all, thank you",0,1,1,0,0
eng_train_track_a_03708,Disgusting performance. [NAME] appears clueless.,0,0,0,0,1
eng_train_track_a_03709,The only cringe is some of y'all obsessing over every little thing Eureka does.,0,1,0,0,0
eng_train_track_a_03710,Me too. Book of Abraham is such a headache for the church. They would love to get rid of it I am sure.,1,0,1,0,0
eng_train_track_a_03711,"Yeah, that was terrible. [NAME] laughing and joking at the end of that game ended his career here.",0,1,1,0,0
eng_train_track_a_03712,I. AM. AWARE. That doesn't make it cool and good for him to race bait.,1,0,1,0,0
eng_train_track_a_03713,Fucking pouliot you're shit,1,0,0,0,0
eng_train_track_a_03714,I thought chiropractors were bad! Look as these medical doctors who were pushing opiates on their patients by the thousands!,1,0,0,0,0
eng_train_track_a_03715,So shocking a couple in their 20s in counseling isn't going to work out.,1,0,0,0,1
eng_train_track_a_03716,"Yeah I probably would've started crying on the spot. Loud, sudden and especially shrill noises are extremely *""cringey""* and uncomfortable and stressful",0,1,0,1,0
eng_train_track_a_03717,I should have changed that stupid lock! I should have made you leave your key!,0,0,0,1,1
eng_train_track_a_03718,Wow. That went south both times. Wanna try for a third?,0,0,0,0,1
eng_train_track_a_03719,But he was so *hurt* when [NAME] acknowledged that homosexuality is a sin.,0,0,0,1,0
eng_train_track_a_03720,Why did no one check [NAME] for her comments though?,0,0,0,0,1
eng_train_track_a_03721,They have great chemistry and it's a cool dynamic but it can't take over the entire show,1,0,1,0,0
eng_train_track_a_03722,I'm so triggered!!!!!!! Please stop you are hurting us with your comments!?!?!?!?!?,0,0,0,1,0
eng_train_track_a_03723,I've edited my comment. Still a shitty game.,1,0,0,1,1
eng_train_track_a_03724,What does all that pill shit they talk about mean anyways? Like what the fuck is a black pill and a red pill?,0,0,0,0,1
eng_train_track_a_03725,I wonder if the formal letter from the psychiatrist will help if cops just decide to shoot her first :(,0,1,0,0,1
eng_train_track_a_03726,I'm confused. If she remarried isn't his income counted as support for the child if they intermingle their finances?,0,0,0,0,1
eng_train_track_a_03727,I would say they do because it was a horrible accident but they were also in the wrong. The military tried to get them to disperse they didnt.,0,0,0,1,0
eng_train_track_a_03728,Then he is innocent. I'd rather have a president that we know for sure isnt undermining our democracy by conspiring with a foreign nation.,0,0,0,1,0
eng_train_track_a_03729,"Poor lady, she was the mother of a friend of my wife, and she went to school with my father in law :(",0,0,0,1,0
eng_train_track_a_03730,"ball just bounced up a bit as [NAME] hit it, unlucky. Need to test [NAME] more, he's really not that great",0,0,1,1,0
eng_train_track_a_03731,"You don't need to screw your face up like that, it's already screwed up enough.",1,0,0,0,0
eng_train_track_a_03732,My favorite pairing now is [NAME] and [NAME]. There's nothing else good. Of course I Like [NAME] and [NAME] too but I miss [NAME] so much,0,0,1,1,0
eng_train_track_a_03733,Is it bad that I don't want any of them?,0,0,0,0,1
eng_train_track_a_03734,A respectful professional doesn't cheap shot multiple training partners ending one's fighting career.,1,0,0,0,0
eng_train_track_a_03735,~~24 hours is for an adult. Adults can get lost but they have means to come back home if they are just lost~~ Edit: forgive my ignorance,0,0,0,1,0
eng_train_track_a_03736,I've always wondered why they play at ear splitting volume instead of one where you can enjoy the music.....,0,0,0,0,1
eng_train_track_a_03737,"Of course it's going backwards, people generally don't want to acknowledge men as the people that hold society on their backs.",0,0,1,1,0
eng_train_track_a_03738,[NAME] would love [NAME]. [NAME] would hate [NAME].,0,0,0,0,1
eng_train_track_a_03739,World has Turned and Left Me Here.,0,0,0,1,0
eng_train_track_a_03740,Aw bummer. She lost her screenshot of the copy of a copy of bullshit articles handwritten in 1992. Somebody help a girl out.,1,0,1,0,0
eng_train_track_a_03741,Hot damn it takes some real self-confidence to say you can't do things in MS paint,1,0,0,0,0
eng_train_track_a_03742,"Why people talk about their prior sex lives is beyond me. There is no upside to doing that, and plenty of downside.",0,0,0,0,1
eng_train_track_a_03743,Sorry for all the questions I just find ASPD to be a fascinating disorder. I have BPD SO to me not having emotions sounds like a dream.,0,0,0,1,1
eng_train_track_a_03744,You mean...I **don't** have to be #blessed and #thankful that I am moving to another country at the end of this month?,0,0,0,0,1
eng_train_track_a_03745,This gets much worse on the 2nd loop.,0,1,0,1,0
eng_train_track_a_03746,Don't be an asshole,1,0,0,0,0
eng_train_track_a_03747,What does having sex with someone you don't love have to do with anything? People do that shit all the time.,0,0,0,0,1
eng_train_track_a_03748,I wouldn't be surprised if their confidence is so shot that they lose this control and lose 3-0,1,0,0,0,1
eng_train_track_a_03749,I wonder if truly might be work stress. He works long hours at a prestigious law firm. I need to five him more credit.,0,0,0,1,1
eng_train_track_a_03750,Little did you know 95% of these kids just don't want to go to school,1,0,0,1,0
eng_train_track_a_03751,- But mom! I don't wanna go to school today! - You're going little shit.,1,0,0,0,0
eng_train_track_a_03752,Edited because my kneejerk response was kind of unnecessarily harsh. :/,0,0,0,1,0
eng_train_track_a_03753,That awkward moment when you fully embrace misogyny but believe homophobia is wrong.,1,0,0,1,0
eng_train_track_a_03754,Shadowbanning me isn't good policy either,0,0,0,0,1
eng_train_track_a_03755,This must have been totally horrifying for you. I'm glad to hear you found peace in the second birth.,0,1,1,0,0
eng_train_track_a_03756,Oh no! More non-existent performance issues to complain about!! Can't wait to be playing it while all these self-righteous gamers take their noble stands...,1,0,0,0,0
eng_train_track_a_03757,I should've left after the first period ended. That was brutal.,0,0,0,1,1
eng_train_track_a_03758,"Omg lmao. Coming from [NAME] too is super embarrassing. I can't really say I feel bad for [NAME] though, he did it to himself. ",1,0,0,1,0
eng_train_track_a_03759,"Eh, says who? Anyway, I like being by myself. I'm by myself right now.",0,0,0,0,1
eng_train_track_a_03760,I feel so sorry for [NAME]..,0,0,1,1,0
eng_train_track_a_03761,"[NAME] is getting frustrated and [NAME] is playing well, not much between the two last few points. Finishing it off is going to be a challenge for [NAME]",0,1,1,0,0
eng_train_track_a_03762,My mom does this all the time. I've always wondered why she feels the need to do it. Can you tell me why you do it?,0,0,0,0,1
eng_train_track_a_03763,Must be why I'm alive. That sucks.,0,0,0,1,1
eng_train_track_a_03764,*Fuck extremists.,1,0,0,0,0
eng_train_track_a_03765,More importantly the car shouldn't have run him over but yeah I guess you're right.,1,0,0,0,0
eng_train_track_a_03766,"What is beautiful about this planet? Nature is cold, harsh and full of suffering and pain. There is nothing beautiful at all about it. ",1,0,0,0,1
eng_train_track_a_03767,I know it's so amazing. Too bad all the people that hate the game haven't thought of giving it a try.,0,0,1,1,0
eng_train_track_a_03768,That sounds a little paranoid,0,1,0,0,0
eng_train_track_a_03769,Her license hasnt been revoked though ;( If purposefully giving people the wrong medecine isnt enough of a reason then idk what.,1,0,0,1,0
eng_train_track_a_03770,[NAME] aren't a race either. Are you trying to be ignorant?,0,0,0,0,1
eng_train_track_a_03771,"RIP [NAME], you were a sweet girl. It's been over 10 years but I still miss you.",0,0,1,1,0
eng_train_track_a_03772,It's more like depression is the default state. We live in a depressing society.,1,0,0,1,1
eng_train_track_a_03773,Best RB draft pick ever? Sure. Best draft pick ever? No lmao,0,0,0,0,1
eng_train_track_a_03774,TSA agents are like tow truck drivers. Everyone hates them.,1,0,0,0,0
eng_train_track_a_03775,"Don't you understand, the people affected are [shuffles deck] able to get a 0% loan until the shutdown is over.",1,0,0,0,0
eng_train_track_a_03776,Iirc congressional opposition was the main obstacle for closing gitmo. I could be misremembering but that's what I remember,1,0,0,0,0
eng_train_track_a_03777,"I am truly sorry for you because that ""song"" is so awful",0,0,0,1,0
eng_train_track_a_03778,There is something legitimately wrong with you,1,1,1,1,0
eng_train_track_a_03779,Being ugly at some point in your life doesn't mean you deserve death.,0,0,0,1,0
eng_train_track_a_03780,"Right now, it feels like a good thing but not a great thing. I don't love it... But I don't hate it. ",1,0,1,0,0
eng_train_track_a_03781,My one regret is not making an account sooner. I lurked for a long time because I felt like I didn't have anything worth saying.,0,1,0,1,0
eng_train_track_a_03782,"Ah man, I've downvoted it now. OP you suck",1,0,0,1,0
eng_train_track_a_03783,"Omg actually?! I mean no judgment , I am just SHOOK ",0,0,0,0,1
eng_train_track_a_03784,"I'm sorry you had a bad experience, that's horrible. But that number saved one of my friends lives. Different for everyone",0,1,0,1,0
eng_train_track_a_03785,Growing soybean on the moon is really going to piss off the trade war neckbeards.,1,0,0,0,0
eng_train_track_a_03786,I would literally rather have the government throw $3k into a shredder than fund this shithead's trip down south,1,0,0,0,0
eng_train_track_a_03787,Wait is this a euphemism for ditching your husband and finding a new partner or did you lose 179 pounds?!?!,0,0,0,1,1
eng_train_track_a_03788,That's what we said about 2017 and 2018 after 2016 it only got worse and it's not gonna get any better I guarantee,0,0,1,1,0
eng_train_track_a_03789,I'm so sorry. Hang in there it'll get easier.,0,0,1,1,0
eng_train_track_a_03790,"Oh no, my secret identity as a neurosurgeon/entomologist/radiologist/anesthetist/dentist has been discovered! I knew I should have given less detailed medical advice online! D: ",0,0,0,0,1
eng_train_track_a_03791,Looks so surreal that i don't even feel anything looking at this.,1,0,0,0,1
